hero_id,hero_ja,role,sub_role,matchup_rating,matchup_type,gameplan,photon_projector,sentry_turret,teleporter,photon_barrier,positioning,watch_moment,in_match_check,priority_targets,forbidden_actions,rank_tips.bronze,rank_tips.silver,rank_tips.gold,rank_tips.platinum,rank_tips.diamond_plus,key_enemy_skills.respect,key_enemy_skills.punish_after,key_enemy_skills.photon_barrier_check,source_comp_stats.threat_symmetra,source_comp_stats.beam_charge_value,source_comp_stats.sentry_turret_value,source_comp_stats.teleporter_value,source_comp_stats.photon_barrier_denial,source_comp_stats.close_space_value,source_comp_stats.matchup_rating,source_comp_stats.priority_score,cross_target_recalibration.version,cross_target_recalibration.enemy_threat,cross_target_recalibration.target_matchup_rating,cross_target_recalibration.matchup_type,cross_target_recalibration.reason,beam_mechanics_note,key_enemy_skills.ultimate_check,source_status,provisional_note,source_comp_stats.mirror_matchup_v41,cross_target_recalibration.mirror_matchup,cross_target_recalibration.diff_points,mirror_matchup_advice.version,mirror_matchup_advice.diff_points,mirror_matchup_advice.summary,sombra_hack_response.hack_cast_start,sombra_hack_response.hack_confirmed.unavailable_skills,sombra_hack_response.hack_confirmed.available_actions,sombra_hack_response.hack_confirmed.fallback,cross_target_recalibration,torbjorn_reassessment_note,main,move,sustain,ultimate,cue,practice,targets,forbidden,rank.bronze,rank.silver,rank.gold,rank.platinum,rank.diamond_plus,normalized_schema,quality_remediation,depth_archetype,depth_first_check,depth_commit_window,depth_reset_rule,depth_practice_question,depth_summary,duplication_guardrail,depth_version,review_pattern,wave_goal,review_question,success_signal,mistake_signal,next_adjustment,vod_marker,micro_drill,review_version
D.Va,D.Va,タンク,イニシエーター,5,侵入経路封鎖・近距離迎撃,D.Vaはディフェンス・マトリックスでビームを止めにくい。ブースター後の着地をダイブ経路で受け、セントリー・タレットとフォトン・プロジェクターで近距離だけ削る。,フォトン・プロジェクターはディフェンス・マトリックス中でも当てやすい主軸。遠いD.Vaを追わず、近づいた瞬間だけビームを当てる。,セントリー・タレットはD.Vaの着地位置と味方後衛へのダイブ経路に置く。自分から追うより、入ってきた場所で反応する。,テレポーターはD.Vaから逃げるためだけでなく、味方後衛の近くへ戻る導線として使う。設置が遅い時は遮蔽優先。,フォトン・バリアはD.Vaの上からの射線と地上の射線を同時に切れる位置へ置く。空中だけを見て置くと地上戦が崩れる。,長い射線の中央に立たず、遮蔽からオーブを撃てる位置を取る。テレポーターで次の遮蔽へ移れる導線を先に作る。,ブースター後、味方後衛へ仕掛けた瞬間,D.Vaに対しては「ブースター後の着地」「ディフェンス・マトリックス中でもビームを当てられる距離」「自爆前の遮蔽」を毎回確認する。,"[""味方後衛へ仕掛けるD.Va"", ""タレットにかかった敵"", ""逃げスキル使用後の敵""]","[""D.Vaを長い射線で正面から撃ち合い続けること"", ""テレポーターなしで開けた場所を歩くこと"", ""セントリー・タレットを敵から見える正面だけに置くこと""]",D.Vaを倒すことより、まずセントリー・タレットをダイブ経路と退路に置く。設置前に正面へ出ない。,フォトン・プロジェクターで追いすぎない。届かない距離ではチャージ・オーブを撃ち、戻る先の遮蔽を決める。,味方が前に出る直前にテレポーターかフォトン・バリアで通路を作る。単独で先に入らない。,同じ角のタレットが壊されたら、次は別のダイブ経路や退路へ置き直す。敵の見る方向を分散させる。,D.Vaの重要スキルを誘ってから、本命のテレポーター展開やフォトン・バリアで射線を分断する。,"[""ブースター"", ""ディフェンス・マトリックス"", ""自爆""]","[""ブースター後"", ""ディフェンス・マトリックス後""]","[""自爆"", ""ブースター""]",8,8,7,7,7,5,5,9,,,,,,,,,,,,,,,,,,,,,,フォトン・プロジェクターはディフェンス・マトリックス中でも当てやすい主軸。遠いD.Vaを追わず、近づいた瞬間だけビームを当てる。,テレポーターはD.Vaから逃げるためだけでなく、味方後衛の近くへ戻る導線として使う。設置が遅い時は遮蔽優先。,セントリー・タレットはD.Vaの着地位置と味方後衛へのダイブ経路に置く。自分から追うより、入ってきた場所で反応する。,フォトン・バリアはD.Vaの上からの射線と地上の射線を同時に切れる位置へ置く。空中だけを見て置くと地上戦が崩れる。,ブースター後、味方後衛へ仕掛けた瞬間,D.Vaに対しては「ブースター後の着地」「ディフェンス・マトリックス中でもビームを当てられる距離」「自爆前の遮蔽」を毎回確認する。,"[""味方後衛へ仕掛けるD.Va"", ""タレットにかかった敵"", ""逃げスキル使用後の敵""]","[""D.Vaを長い射線で正面から撃ち合い続けること"", ""テレポーターなしで開けた場所を歩くこと"", ""セントリー・タレットを敵から見える正面だけに置くこと""]",D.Vaを倒すことより、まずセントリー・タレットをダイブ経路と退路に置く。設置前に正面へ出ない。,フォトン・プロジェクターで追いすぎない。届かない距離ではチャージ・オーブを撃ち、戻る先の遮蔽を決める。,味方が前に出る直前にテレポーターかフォトン・バリアで通路を作る。単独で先に入らない。,同じ角のタレットが壊されたら、次は別のダイブ経路や退路へ置き直す。敵の見る方向を分散させる。,D.Vaの重要スキルを誘ってから、本命のテレポーター展開やフォトン・バリアで射線を分断する。,v50.16_canonical_detail_fields,Pack P: common detail fields and timing cleanup applied,接近時のダイブ経路と帰り道を管理するタンク,D.Vaのダイブ経路を撃つ前に、着地点・帰り道・味方サポートへの距離を先に確認する。,D.Vaが防御資源を見せた直後に倒し切ろうとせず、戻る向きが決まった瞬間へフォトン・プロジェクターとセントリー・タレットを合わせる。,削った後はテレポーターで同じ場所から離れ、敵サポートか孤立ダメージへ視線を切り替える。,試合後に「D.Vaの何を見てから撃ったか」「外した時にどこへ戻ったか」を1回だけ確認する。,シンメトラ対D.Vaは、接近時のダイブ経路と帰り道を管理するタンクとして読む。最初に見る情報、撃つ瞬間、失敗時の戻り先を分けると、数値評価以上に安定する。,D.Vaへの説明は「撃つ」「追う」だけで終わらせない。ダイブ確認、倒し切りを狙う条件、撤退先、次の狙いを必ず1文ずつ分け、シンメトラのフォトン・プロジェクターとセントリー・タレットとテレポーターの使い道を混同しない。,v50.17,接近管理,D.Vaのダイブ経路を止めるより、帰り道と味方サポートへの距離を見て被害を小さくする。,この試合で「D.Vaのダイブ経路を撃つ前に、着地点・帰り道・味方サポートへの距離を先に確認する。」を守れたか。守れなかった場合、次は撃つ前に何を1つだけ見るか。,D.Vaが防御資源を見せた直後に倒し切ろうとせず、戻る向きが決まった瞬間へフォトン・プロジェクターとセントリー・タレットを合わせる。 次に削った後はテレポーターで同じ場所から離れ、敵サポートか孤立ダメージへ視線を切り替える。できていれば成功。,D.Vaを正面で追い続け、敵サポートの回復線まで自分から入ってしまう。,次の試合ではダイブ後の着地を1秒だけ撃ち、戻る向きが決まった瞬間へチャージ・オーブを残す。,D.Vaが入った瞬間、味方サポートの体力、テレポーターを使った位置を停止して確認する。,次の試合ではD.Vaを倒すことより、確認、攻撃、退避の順番を崩さない。,v50.18
Winston,ウィンストン,タンク,イニシエーター,4,侵入経路封鎖・近距離迎撃,ウィンストンはバリアやシールドを撃てる時間がビーム維持の好機。無理に本体へ出ず、遮蔽を使ってフォトン・プロジェクターを維持してから前線へ圧を出す。,フォトン・プロジェクターはバリアやシールドを撃てる時に価値が高い。残弾を保ちながらビームを維持し、角を越えた敵本体へつなげる。,セントリー・タレットはウィンストンを倒す罠ではなく、接近を遅らせる警報として使う。味方後衛へ入る通路と自分の退路に分けて置く。,テレポーターはウィンストンから逃げるためだけでなく、味方後衛の近くへ戻る導線として使う。設置が遅い時は遮蔽優先。,フォトン・バリアはウィンストンの火力をただ受ける壁ではなく、味方が前に出る通路を作るために使う。,味方後衛から離れすぎず、ダイブ経路・側面ルート・退路をセントリー・タレットで見られる位置に立つ。,ジャンプ・パック後、味方後衛へ仕掛けた瞬間,ウィンストンに対しては「バリアを撃てる時間」「ビームを維持できる角」「テレポーターで下がる出口」を毎回確認する。,"[""味方後衛へ仕掛けるウィンストン"", ""タレットにかかった敵"", ""逃げスキル使用後の敵""]","[""ウィンストンを一人で深追いすること"", ""セントリー・タレットを同じ場所に固めて全部壊されること"", ""テレポーターを逃げ道なしの敵陣側へ置くこと""]",ウィンストンを倒すことより、まずセントリー・タレットをダイブ経路と退路に置く。設置前に正面へ出ない。,フォトン・プロジェクターで追いすぎない。届かない距離ではチャージ・オーブを撃ち、戻る先の遮蔽を決める。,味方が前に出る直前にテレポーターかフォトン・バリアで通路を作る。単独で先に入らない。,同じ角のタレットが壊されたら、次は別のダイブ経路や退路へ置き直す。敵の見る方向を分散させる。,ウィンストンの重要スキルを誘ってから、本命のテレポーター展開やフォトン・バリアで射線を分断する。,"[""ジャンプ・パック"", ""バリア・プロジェクター"", ""テスラ・キャノン""]","[""ジャンプ・パック後"", ""バリア・プロジェクター後""]","[""バリア・プロジェクター"", ""ジャンプ・パック""]",7,8,8,7,6,5,6,7,,,,,,,,,,,,,,,,,,,,,,フォトン・プロジェクターはバリアやシールドを撃てる時に価値が高い。残弾を保ちながらビームを維持し、角を越えた敵本体へつなげる。,テレポーターはウィンストンから逃げるためだけでなく、味方後衛の近くへ戻る導線として使う。設置が遅い時は遮蔽優先。,セントリー・タレットはウィンストンを倒す罠ではなく、接近を遅らせる警報として使う。味方後衛へ入る通路と自分の退路に分けて置く。,フォトン・バリアはウィンストンの火力をただ受ける壁ではなく、味方が前に出る通路を作るために使う。,ジャンプ・パック後、味方後衛へ仕掛けた瞬間,ウィンストンに対しては「バリアを撃てる時間」「ビームを維持できる角」「テレポーターで下がる出口」を毎回確認する。,"[""味方後衛へ仕掛けるウィンストン"", ""タレットにかかった敵"", ""逃げスキル使用後の敵""]","[""ウィンストンを一人で深追いすること"", ""セントリー・タレットを同じ場所に固めて全部壊されること"", ""テレポーターを逃げ道なしの敵陣側へ置くこと""]",ウィンストンを倒すことより、まずセントリー・タレットをダイブ経路と退路に置く。設置前に正面へ出ない。,フォトン・プロジェクターで追いすぎない。届かない距離ではチャージ・オーブを撃ち、戻る先の遮蔽を決める。,味方が前に出る直前にテレポーターかフォトン・バリアで通路を作る。単独で先に入らない。,同じ角のタレットが壊されたら、次は別のダイブ経路や退路へ置き直す。敵の見る方向を分散させる。,ウィンストンの重要スキルを誘ってから、本命のテレポーター展開やフォトン・バリアで射線を分断する。,v50.16_canonical_detail_fields,Pack P: common detail fields and timing cleanup applied,接近時のダイブ経路と帰り道を管理するタンク,ウィンストンのダイブ経路を撃つ前に、着地点・帰り道・味方サポートへの距離を先に確認する。,ウィンストンが防御資源を見せた直後に倒し切ろうとせず、戻る向きが決まった瞬間へフォトン・プロジェクターとセントリー・タレットを合わせる。,削った後はテレポーターで同じ場所から離れ、敵サポートか孤立ダメージへ視線を切り替える。,試合後に「ウィンストンの何を見てから撃ったか」「外した時にどこへ戻ったか」を1回だけ確認する。,シンメトラ対ウィンストンは、接近時のダイブ経路と帰り道を管理するタンクとして読む。最初に見る情報、撃つ瞬間、失敗時の戻り先を分けると、数値評価以上に安定する。,ウィンストンへの説明は「撃つ」「追う」だけで終わらせない。ダイブ確認、倒し切りを狙う条件、撤退先、次の狙いを必ず1文ずつ分け、シンメトラのフォトン・プロジェクターとセントリー・タレットとテレポーターの使い道を混同しない。,v50.17,接近管理,ウィンストンのダイブ経路を止めるより、帰り道と味方サポートへの距離を見て被害を小さくする。,この試合で「ウィンストンのダイブ経路を撃つ前に、着地点・帰り道・味方サポートへの距離を先に確認する。」を守れたか。守れなかった場合、次は撃つ前に何を1つだけ見るか。,ウィンストンが防御資源を見せた直後に倒し切ろうとせず、戻る向きが決まった瞬間へフォトン・プロジェクターとセントリー・タレットを合わせる。 次に削った後はテレポーターで同じ場所から離れ、敵サポートか孤立ダメージへ視線を切り替える。できていれば成功。,ウィンストンを正面で追い続け、敵サポートの回復線まで自分から入ってしまう。,次の試合ではダイブ後の着地を1秒だけ撃ち、戻る向きが決まった瞬間へチャージ・オーブを残す。,ウィンストンが入った瞬間、味方サポートの体力、テレポーターを使った位置を停止して確認する。,次の試合ではウィンストンを倒すことより、確認、攻撃、退避の順番を崩さない。,v50.18
Orisa,オリーサ,タンク,ブルーザー,6,前線火力増幅・ダイブ経路制圧,オリーサ相手は近距離のダイブ経路が主戦場。射程に入った瞬間にフォトン・プロジェクターを当て続け、危なくなる前にテレポーターで位置を変える。,フォトン・プロジェクターはオリーサが射程に入った時に価値が出る。当て続けられる距離だけ戦い、射線が増えたら欲張らず遮蔽へ戻る。,セントリー・タレットはオリーサのダイブ経路に重ねる。正面だけでなく、正面のスペースへ入った後に戻る通路にも置くと近距離戦が安定する。,テレポーターはオリーサに押された時の退路と、別遮蔽から撃ち直すために使う。敵正面へ置くと壊されやすい。,フォトン・バリアはオリーサ本体だけでなく、後ろの回復射線を切るために使う。前線と後衛を分断できる向きを選ぶ。,敵が正面のスペースへ入るダイブ経路の一歩後ろに立ち、ビームが届く距離だけ戦う。押されたらテレポーターで別の遮蔽へ移る。,射程に入った瞬間、または前線スキル使用後,オリーサに対しては「タレットで見るダイブ経路」「テレポーターの出口」「フォトン・バリアで切る射線」を毎回確認する。,"[""オリーサ本体"", ""回復を受けている前線"", ""横に出たダメージ""]","[""オリーサの正面で逃げ道なくビームを当て続けること"", ""押された後にテレポーターの出口を探し始めること"", ""フォトン・バリアを後衛分断に使えない向きへ置くこと""]",オリーサを倒すことより、まずセントリー・タレットをダイブ経路と退路に置く。設置前に正面へ出ない。,フォトン・プロジェクターで追いすぎない。届かない距離ではチャージ・オーブを撃ち、戻る先の遮蔽を決める。,味方が前に出る直前にテレポーターかフォトン・バリアで通路を作る。単独で先に入らない。,同じ角のタレットが壊されたら、次は別のダイブ経路や退路へ置き直す。敵の見る方向を分散させる。,オリーサの重要スキルを誘ってから、本命のテレポーター展開やフォトン・バリアで射線を分断する。,"[""フォーティファイ"", ""ジャベリン・スピン"", ""エネルギー・ジャベリン""]","[""エネルギー・ジャベリン"", ""フォーティファイ"", ""ジャベリン・スピン""]","[""フォーティファイ"", ""ジャベリン・スピン"", ""エネルギー・ジャベリン""]",6,8,5,5,5,8,6,6,,,,,,,,,,,,,,,,,,,,,,フォトン・プロジェクターはオリーサが射程に入った時に価値が出る。当て続けられる距離だけ戦い、射線が増えたら欲張らず遮蔽へ戻る。,テレポーターはオリーサに押された時の退路と、別遮蔽から撃ち直すために使う。敵正面へ置くと壊されやすい。,セントリー・タレットはオリーサのダイブ経路に重ねる。正面だけでなく、正面のスペースへ入った後に戻る通路にも置くと近距離戦が安定する。,フォトン・バリアはオリーサ本体だけでなく、後ろの回復射線を切るために使う。前線と後衛を分断できる向きを選ぶ。,射程に入った瞬間、または前線スキル使用後,オリーサに対しては「タレットで見るダイブ経路」「テレポーターの出口」「フォトン・バリアで切る射線」を毎回確認する。,"[""オリーサ本体"", ""回復を受けている前線"", ""横に出たダメージ""]","[""オリーサの正面で逃げ道なくビームを当て続けること"", ""押された後にテレポーターの出口を探し始めること"", ""フォトン・バリアを後衛分断に使えない向きへ置くこと""]",オリーサを倒すことより、まずセントリー・タレットをダイブ経路と退路に置く。設置前に正面へ出ない。,フォトン・プロジェクターで追いすぎない。届かない距離ではチャージ・オーブを撃ち、戻る先の遮蔽を決める。,味方が前に出る直前にテレポーターかフォトン・バリアで通路を作る。単独で先に入らない。,同じ角のタレットが壊されたら、次は別のダイブ経路や退路へ置き直す。敵の見る方向を分散させる。,オリーサの重要スキルを誘ってから、本命のテレポーター展開やフォトン・バリアで射線を分断する。,v50.16_canonical_detail_fields,Pack P: common detail fields and timing cleanup applied,高耐久資源を削って後衛へ切り替えるタンク,オリーサだけを倒す設計にせず、回復線・防御資源・後衛の露出を同時に見る。,オリーサが前へ出た瞬間は削り、防御・救助・移動スキルを使った直後に後ろのサポートか横のダメージへフォトン・プロジェクターとセントリー・タレットを移す。,正面で長く撃ち続けず、テレポーターで射線を変えて敵の回復と防御を分散させる。,試合後に「オリーサの何を見てから撃ったか」「外した時にどこへ戻ったか」を1回だけ確認する。,シンメトラ対オリーサは、高耐久資源を削って後衛へ切り替えるタンクとして読む。最初に見る情報、撃つ瞬間、失敗時の戻り先を分けると、数値評価以上に安定する。,オリーサへの説明は「撃つ」「追う」だけで終わらせない。ダイブ確認、倒し切りを狙う条件、撤退先、次の狙いを必ず1文ずつ分け、シンメトラのフォトン・プロジェクターとセントリー・タレットとテレポーターの使い道を混同しない。,v50.17,資源削り,オリーサを倒し切るより、防御資源を吐かせて後衛へ切り替える準備を作る。,この試合で「オリーサだけを倒す設計にせず、回復線・防御資源・後衛の露出を同時に見る。」を守れたか。守れなかった場合、次は撃つ前に何を1つだけ見るか。,オリーサが前へ出た瞬間は削り、防御・救助・移動スキルを使った直後に後ろのサポートか横のダメージへフォトン・プロジェクターとセントリー・タレットを移す。 次に正面で長く撃ち続けず、テレポーターで射線を変えて敵の回復と防御を分散させる。できていれば成功。,オリーサだけに射撃時間を使い、後衛や横のダメージを見られなくなる。,次の試合ではオリーサを削った後、防御・救助・移動スキルを使わせた時点で別の敵へ照準を移す。,オリーサへ撃った時間と、後衛へ切り替えた瞬間を確認する。,次の試合ではオリーサを倒すことより、確認、攻撃、退避の順番を崩さない。,v50.18
