hero_id,ashe_comp_stats.threat_ashe,ashe_comp_stats.dynamite_value,ashe_comp_stats.coach_gun_value,ashe_comp_stats.viper_value,ashe_comp_stats.bob_denial,ashe_comp_stats.highground_value,ashe_comp_stats.matchup_rating,ashe_comp_stats.priority_score,composition_tags,key_enemy_skills.respect,key_enemy_skills.punish_after,key_enemy_skills.dynamite_check,key_enemy_skills.bob_check,diagnosis_snippets.positioning,diagnosis_snippets.target_priority,diagnosis_snippets.dynamite_policy,diagnosis_snippets.bob_condition,ashe_comp_stats.mirror_matchup_v41,diagnosis_snippets.mirror_matchup_note,diagnosis_snippets.cross_target_note,diagnosis_snippets.mirror_diff_points,cross_target_recalibration.version,cross_target_recalibration.enemy_threat,cross_target_recalibration.target_matchup_rating,cross_target_recalibration.matchup_type,cross_target_recalibration.diff_points,source_status,source_note,cross_target_recalibration,torbjorn_reassessment_note
Moira,6,10,7,8,5,4,8,7,"[""support_or_save_check"", ""dynamite_value""]","[""フェード"", ""コアレッセンス""]","[""フェード"", ""バイオティック・オーブ""]","[""フェード""]","[""フェード"", ""コアレッセンス""]",モイラ相手は、最初に安全な中〜遠距離の遮蔽か高台を使う。確認するタイミングは「フェード、バイオティック・オーブの後」。長く覗かず、撃った後は遮蔽へ戻る。,ザ・ヴァイパーで先に体力差を作り、ダイナマイトで遮蔽裏や集団を動かす。倒し切れない時は敵サポートへ圧を切り替える。,ダイナマイトはモイラ本人だけでなく、回復を受ける位置、逃げ道、味方タンクが当たるダイブ経路に使う。単体牽制で毎回使い切らない。,フェード、コアレッセンスを確認してからB.O.Bを出す。,,,,,,,,,,,,,
Lúcio,7,10,7,8,9,4,7,7,"[""support_or_save_check"", ""dynamite_value"", ""bob_must_check""]","[""サウンド・バリア"", ""ウォール・ライド""]","[""ウォール・ライド"", ""サウンドウェーブ"", ""アンプ・イット・アップ""]","[""サウンド・バリア"", ""ウォール・ライド""]","[""サウンド・バリア""]",ルシオ相手は、最初に安全な中〜遠距離の遮蔽か高台を使う。確認するタイミングは「ウォール・ライド、サウンドウェーブの後」。長く覗かず、撃った後は遮蔽へ戻る。,ザ・ヴァイパーで先に体力差を作り、ダイナマイトで遮蔽裏や集団を動かす。倒し切れない時は敵サポートへ圧を切り替える。,ダイナマイトはルシオ本人だけでなく、回復を受ける位置、逃げ道、味方タンクが当たるダイブ経路に使う。単体牽制で毎回使い切らない。,サウンド・バリアを確認してからB.O.Bを出す。,,,,,,,,,,,,,
Ana,5,8,5,8,10,4,8,6,"[""support_or_save_check"", ""bob_must_check""]","[""スリープ・ダーツ"", ""ナノ・ブースト""]","[""スリープ・ダーツ"", ""バイオティック・グレネード""]","[""スリープ・ダーツ""]","[""スリープ・ダーツ"", ""ナノ・ブースト""]",アナ相手は、最初に安全な中〜遠距離の遮蔽か高台を使う。確認するタイミングは「スリープ・ダーツ後、またはバイオティック・グレネードを使った後」。長く覗かず、撃った後は遮蔽へ戻る。,ザ・ヴァイパーで先に体力差を作り、ダイナマイトで遮蔽裏や集団を動かす。倒し切れない時は敵サポートへ圧を切り替える。,ダイナマイトはアナ本人だけでなく、回復を受ける位置、逃げ道、味方タンクが当たるダイブ経路に使う。単体牽制で毎回使い切らない。,スリープ・ダーツ、ナノ・ブーストを確認してからB.O.Bを出す。,,,,,,,,,,,,,
Wuyang,6,8,6,8,9,4,7,6,"[""support_or_save_check"", ""bob_must_check""]","[""養神泉"", ""驚濤破"", ""飛流歩""]","[""飛流歩"", ""玄武之杖"", ""驚濤破""]","[""養神泉"", ""驚濤破"", ""飛流歩""]","[""養神泉"", ""驚濤破"", ""守衛波浪""]",ウーヤン相手は、最初に安全な中〜遠距離の遮蔽か高台を使う。確認するタイミングは「飛流歩、玄武之杖の後」。長く覗かず、撃った後は遮蔽へ戻る。,ザ・ヴァイパーで先に体力差を作り、ダイナマイトで遮蔽裏や集団を動かす。倒し切れない時は敵サポートへ圧を切り替える。,ダイナマイトはウーヤン本人だけでなく、回復を受ける位置、逃げ道、味方タンクが当たるダイブ経路に使う。単体牽制で毎回使い切らない。,養神泉、驚濤破、守衛波浪を確認してからB.O.Bを出す。,,,,,,,,,,,,,
Zenyatta,5,8,6,8,9,4,8,6,"[""support_or_save_check"", ""bob_must_check""]","[""心頭滅却"", ""不和のオーブ""]","[""不和のオーブ""]","[""心頭滅却""]","[""心頭滅却"", ""不和のオーブ""]",ゼニヤッタ相手は、最初に安全な中〜遠距離の遮蔽か高台を使う。確認するタイミングは「不和のオーブが味方タンクに付いた直後、または心頭滅却を切った後」。長く覗かず、撃った後は遮蔽へ戻る。,ザ・ヴァイパーで先に体力差を作り、ダイナマイトで遮蔽裏や集団を動かす。倒し切れない時は敵サポートへ圧を切り替える。,ダイナマイトはゼニヤッタ本人だけでなく、回復を受ける位置、逃げ道、味方タンクが当たるダイブ経路に使う。単体牽制で毎回使い切らない。,心頭滅却、不和のオーブを確認してからB.O.Bを出す。,,,,,,,,,,,,,
Mizuki,6,8,6,8,6,4,7,7,"[""support_or_save_check""]","[""霊域結界"", ""快気の笠"", ""形代""]","[""形代"", ""呪縛""]","[""霊域結界"", ""快気の笠"", ""形代""]","[""霊域結界"", ""快気の笠"", ""癒しの波動""]",ミズキ相手は、最初に安全な中〜遠距離の遮蔽か高台を使う。確認するタイミングは「形代、呪縛の後」。長く覗かず、撃った後は遮蔽へ戻る。,ザ・ヴァイパーで先に体力差を作り、ダイナマイトで遮蔽裏や集団を動かす。倒し切れない時は敵サポートへ圧を切り替える。,ダイナマイトはミズキ本人だけでなく、回復を受ける位置、逃げ道、味方タンクが当たるダイブ経路に使う。単体牽制で毎回使い切らない。,霊域結界、快気の笠、癒しの波動を確認してからB.O.Bを出す。,,,,,,,,,,,,,
